{
  "$schema": "https://json-schema.org/draft/2020-12/schema",
  "$id": "https://github.com/SidianLabs/micro-agent-protocol/raw/main/schemas/delegation-token.schema.json",
  "title": "MAP Delegation Token",
  "type": "object",
  "additionalProperties": false,
  "required": [
    "issuer",
    "subject_agent",
    "allowed_actions",
    "resource_scope",
    "constraints",
    "signature"
  ],
  "properties": {
    "issuer": {
      "type": "string",
      "minLength": 1
    },
    "subject_agent": {
      "type": "string",
      "minLength": 1
    },
    "allowed_actions": {
      "type": "array",
      "minItems": 1,
      "items": {
        "type": "string",
        "minLength": 1
      }
    },
    "resource_scope": {
      "type": "object"
    },
    "constraints": {
      "type": "object",
      "required": [
        "common",
        "domain",
        "expires_at"
      ],
      "properties": {
        "common": {
          "type": "object",
          "additionalProperties": false,
          "properties": {
            "resource_id": {
              "type": "string"
            },
            "resource_ids": {
              "type": "array",
              "items": {
                "type": "string"
              }
            },
            "environment": {
              "type": "string",
              "enum": [
                "development",
                "staging",
                "production"
              ]
            },
            "max_amount": {
              "type": "number"
            },
            "currency": {
              "type": "string"
            },
            "limit": {
              "type": "integer",
              "minimum": 1
            },
            "approval_required": {
              "type": "boolean"
            },
            "redaction_level": {
              "type": "string",
              "enum": [
                "none",
                "basic",
                "strict"
              ]
            }
          }
        },
        "domain": {
          "type": "object"
        },
        "expires_at": {
          "type": "string",
          "format": "date-time"
        }
      },
      "additionalProperties": true
    },
    "approval_reference": {
      "type": "string"
    },
    "requester_identity": {
      "type": "object",
      "additionalProperties": false,
      "required": [
        "type",
        "id"
      ],
      "properties": {
        "type": {
          "type": "string",
          "enum": [
            "user",
            "service",
            "agent"
          ]
        },
        "id": {
          "type": "string",
          "minLength": 1
        },
        "tenant_id": {
          "type": "string",
          "minLength": 1
        }
      }
    },
    "signature": {
      "type": "string",
      "minLength": 1
    }
  }
}
