{
  "issuer": "map-policy-service",
  "subject_agent": "dbread-agent-v1",
  "allowed_actions": [
    "db.read.aggregate"
  ],
  "resource_scope": {
    "environment": "staging",
    "dataset": "incident_metrics"
  },
  "constraints": {
    "common": {
      "environment": "staging",
      "limit": 5,
      "redaction_level": "basic"
    },
    "domain": {
      "query_type": "aggregate",
      "dataset": "incident_metrics",
      "service": "payments"
    },
    "expires_at": "2026-03-19T18:05:00Z"
  },
  "requester_identity": {
    "type": "user",
    "id": "engineer_17"
  },
  "signature": "sig_demo_db_token"
}
